{
  "schema_version": 1,
  "output_dir": "results/router_v2/rad/full",
  "dataset_dir": "dataset/rad_benchmark",
  "base_model_path": "models/gpt2-medium",
  "guide_model_path": "results/router_v2/sentiment_guide/final_adapter",
  "sentiment_classifier_path": "models/sentiment-roberta-large-english",
  "taro_checkpoint_path": "results/router_v2/training/taro/best.pt",
  "state_checkpoint_path": "results/router_v2/training/state/best.pt",
  "history_checkpoint_path": "results/router_v2/training/history/best.pt",
  "v1_results_dir": "router/evaluation/report_run_32tokens",
  "prompt_classes": ["negative", "neutral", "positive"],
  "validation_prompt_limit_per_class": 50,
  "test_prompt_limit_per_class": 200,
  "test_prompt_offset_per_class": 50,
  "seeds": [1],
  "fixed_lambda_sweep": [0.0, 0.25, 0.5, 0.75, 1.0],
  "heuristic_methods": ["heuristic_entropy_gap", "heuristic_js"],
  "max_new_tokens": 32,
  "top_k": 20,
  "temperature": 1.0,
  "do_sample": false,
  "stop_on_eos": false,
  "device": "auto",
  "allow_cpu_fallback": true,
  "precision": "fp32",
  "sentiment_classifier_device": "cpu",
  "sentiment_classifier_batch_size": 16,
  "bootstrap_samples": 1000,
  "bootstrap_seed": 12345,
  "log_every_jobs": 10
}
